<?xml version="1.0" encoding="UTF-8" ?>
<xs:schema  xmlns:xs="http://www.w3.org/2001/XMLSchema">
    <xs:element name="pedidos">
        <xs:complexType>
            <xs:sequence>
                <xs:element name="pedido" maxOccurs="unbounded">
                    <xs:complexType>
                        <xs:sequence>
                            <xs:element name="numeroserie" type="xs:string" maxOccurs="1"/>
                            <xs:element name="cantidad" type="xs:string" maxOccurs="1"/>
                            <xs:element name="peso" type="xs:string" maxOccurs="1"/>
                        </xs:sequence>
                    </xs:complexType>
                </xs:element>
            </xs:sequence>
        </xs:complexType>
    </xs:element>
</xs:schema>